{
  "contract_version": "aether-ecosystem-config.v1",
  "scenario_id": "ecosystem-cross-organization-data-request",
  "title": "Cross-organization data request",
  "description": "A fictional data request traverses declared processors while retaining event-backed lineage and boundaries.",
  "scenario_kind": "cross-organization-data-request",
  "seed": 63006,
  "scale": 1,
  "limitations": [
    "The workflow is not a legal determination or production request process."
  ]
}
