{
  "contract_version": "aether-ecosystem-config.v1",
  "scenario_id": "ecosystem-saas-service-network",
  "title": "Software service and payment network",
  "description": "A fictional software company interacts with a payment provider, customer enterprise, and support vendor.",
  "scenario_kind": "saas-service-network",
  "seed": 63001,
  "scale": 1,
  "limitations": [
    "Service usage and settlement are simplified deterministic research states."
  ]
}
