{
  "contract_version": "aether-ecosystem-config.v1",
  "scenario_id": "ecosystem-professional-services-network",
  "title": "Professional services delivery network",
  "description": "A fictional services firm uses a subcontractor and shared software provider to serve a client enterprise.",
  "scenario_kind": "professional-services-network",
  "seed": 63003,
  "scale": 1,
  "limitations": [
    "Work acceptance and subcontracting are simplified research assumptions."
  ]
}
