{
  "contract_version": "aether-ecosystem-config.v1",
  "scenario_id": "ecosystem-customer-default-cascade",
  "title": "Customer default cascade",
  "description": "A fictional customer default propagates into supplier, bank, and capacity-provider decisions.",
  "scenario_kind": "customer-default-cascade",
  "seed": 63005,
  "scale": 1,
  "limitations": [
    "Default and capacity effects are synthetic and not credit guidance."
  ]
}
