{
  "contract_version": "aether-ecosystem-config.v1",
  "scenario_id": "ecosystem-retail-supply-network",
  "title": "Retail supply and fulfilment network",
  "description": "A fictional retailer, manufacturer, logistics provider, bank, and customer group reconcile trade and delivery.",
  "scenario_kind": "retail-supply-network",
  "seed": 63002,
  "scale": 1,
  "limitations": [
    "Trade, credit, and delivery states exclude provider-specific settlement."
  ]
}
